"Status","Start Time","Stop Time","Duration in ms","Parent Suite","Suite","Sub Suite","Test Class","Test Method","Name","Description"
"passed","Fri Aug 22 19:17:57 GMT 2025","Fri Aug 22 19:17:57 GMT 2025","661","","Attempt to Retrieve Brewery with Invalid ID","","","","Attempt to Retrieve Brewery with Invalid ID",""
"passed","Fri Aug 22 19:17:59 GMT 2025","Fri Aug 22 19:18:00 GMT 2025","652","","Attempt to Retrieve Random Breweries with Out-of-Bounds Size","","","","Attempt to Retrieve Random Breweries with Out-of-Bounds Size",""
"passed","Fri Aug 22 19:17:58 GMT 2025","Fri Aug 22 19:17:59 GMT 2025","704","","Retrieve Multiple Random Breweries","","","","Retrieve Multiple Random Breweries",""
"passed","Fri Aug 22 19:17:57 GMT 2025","Fri Aug 22 19:17:58 GMT 2025","717","","Retrieve a Single Random Brewery","","","","Retrieve a Single Random Brewery",""
"passed","Fri Aug 22 19:17:56 GMT 2025","Fri Aug 22 19:17:57 GMT 2025","691","","Retrieve Brewery Successfully","","","","Retrieve Brewery Successfully",""
