"Status","Start Time","Stop Time","Duration in ms","Parent Suite","Suite","Sub Suite","Test Class","Test Method","Name","Description"
"passed","Sat Aug 02 19:18:01 GMT 2025","Sat Aug 02 19:18:01 GMT 2025","241","","Retrieve a Single Random Brewery","","","","Retrieve a Single Random Brewery",""
"passed","Sat Aug 02 19:18:00 GMT 2025","Sat Aug 02 19:18:00 GMT 2025","492","","Retrieve Brewery Successfully","","","","Retrieve Brewery Successfully",""
"passed","Sat Aug 02 19:18:00 GMT 2025","Sat Aug 02 19:18:01 GMT 2025","261","","Attempt to Retrieve Brewery with Invalid ID","","","","Attempt to Retrieve Brewery with Invalid ID",""
"passed","Sat Aug 02 19:18:01 GMT 2025","Sat Aug 02 19:18:01 GMT 2025","173","","Attempt to Retrieve Random Breweries with Out-of-Bounds Size","","","","Attempt to Retrieve Random Breweries with Out-of-Bounds Size",""
"passed","Sat Aug 02 19:18:01 GMT 2025","Sat Aug 02 19:18:01 GMT 2025","303","","Retrieve Multiple Random Breweries","","","","Retrieve Multiple Random Breweries",""
