"Status","Start Time","Stop Time","Duration in ms","Parent Suite","Suite","Sub Suite","Test Class","Test Method","Name","Description"
"passed","Sun Apr 13 19:15:20 GMT 2025","Sun Apr 13 19:15:21 GMT 2025","314","","Retrieve a Single Random Brewery","","","","Retrieve a Single Random Brewery",""
"passed","Sun Apr 13 19:15:21 GMT 2025","Sun Apr 13 19:15:21 GMT 2025","282","","Retrieve Multiple Random Breweries","","","","Retrieve Multiple Random Breweries",""
"failed","Sun Apr 13 19:15:21 GMT 2025","Sun Apr 13 19:15:21 GMT 2025","298","","Attempt to Retrieve Random Breweries with Out-of-Bounds Size","","","","Attempt to Retrieve Random Breweries with Out-of-Bounds Size",""
"passed","Sun Apr 13 19:15:20 GMT 2025","Sun Apr 13 19:15:20 GMT 2025","569","","Retrieve Brewery Successfully","","","","Retrieve Brewery Successfully",""
"passed","Sun Apr 13 19:15:20 GMT 2025","Sun Apr 13 19:15:20 GMT 2025","268","","Attempt to Retrieve Brewery with Invalid ID","","","","Attempt to Retrieve Brewery with Invalid ID",""
