"Status","Start Time","Stop Time","Duration in ms","Parent Suite","Suite","Sub Suite","Test Class","Test Method","Name","Description"
"passed","Fri Mar 14 19:16:33 GMT 2025","Fri Mar 14 19:16:33 GMT 2025","129","","Retrieve a Single Random Brewery","","","","Retrieve a Single Random Brewery",""
"passed","Fri Mar 14 19:16:33 GMT 2025","Fri Mar 14 19:16:33 GMT 2025","352","","Retrieve Brewery Successfully","","","","Retrieve Brewery Successfully",""
"passed","Fri Mar 14 19:16:33 GMT 2025","Fri Mar 14 19:16:33 GMT 2025","119","","Attempt to Retrieve Brewery with Invalid ID","","","","Attempt to Retrieve Brewery with Invalid ID",""
"passed","Fri Mar 14 19:16:33 GMT 2025","Fri Mar 14 19:16:33 GMT 2025","83","","Attempt to Retrieve Random Breweries with Out-of-Bounds Size","","","","Attempt to Retrieve Random Breweries with Out-of-Bounds Size",""
"passed","Fri Mar 14 19:16:33 GMT 2025","Fri Mar 14 19:16:33 GMT 2025","71","","Retrieve Multiple Random Breweries","","","","Retrieve Multiple Random Breweries",""
