"Status","Start Time","Stop Time","Duration in ms","Parent Suite","Suite","Sub Suite","Test Class","Test Method","Name","Description"
"passed","Tue Jan 28 19:15:06 GMT 2025","Tue Jan 28 19:15:07 GMT 2025","101","","Retrieve a Single Random Brewery","","","","Retrieve a Single Random Brewery",""
"passed","Tue Jan 28 19:15:07 GMT 2025","Tue Jan 28 19:15:07 GMT 2025","82","","Retrieve Multiple Random Breweries","","","","Retrieve Multiple Random Breweries",""
"passed","Tue Jan 28 19:15:07 GMT 2025","Tue Jan 28 19:15:07 GMT 2025","77","","Attempt to Retrieve Random Breweries with Out-of-Bounds Size","","","","Attempt to Retrieve Random Breweries with Out-of-Bounds Size",""
"passed","Tue Jan 28 19:15:06 GMT 2025","Tue Jan 28 19:15:06 GMT 2025","259","","Retrieve Brewery Successfully","","","","Retrieve Brewery Successfully",""
"passed","Tue Jan 28 19:15:06 GMT 2025","Tue Jan 28 19:15:06 GMT 2025","116","","Attempt to Retrieve Brewery with Invalid ID","","","","Attempt to Retrieve Brewery with Invalid ID",""
