"Status","Start Time","Stop Time","Duration in ms","Parent Suite","Suite","Sub Suite","Test Class","Test Method","Name","Description"
"passed","Fri Feb 14 19:15:49 GMT 2025","Fri Feb 14 19:15:49 GMT 2025","118","","Retrieve a Single Random Brewery","","","","Retrieve a Single Random Brewery",""
"passed","Fri Feb 14 19:15:49 GMT 2025","Fri Feb 14 19:15:49 GMT 2025","62","","Retrieve Multiple Random Breweries","","","","Retrieve Multiple Random Breweries",""
"passed","Fri Feb 14 19:15:49 GMT 2025","Fri Feb 14 19:15:49 GMT 2025","62","","Attempt to Retrieve Random Breweries with Out-of-Bounds Size","","","","Attempt to Retrieve Random Breweries with Out-of-Bounds Size",""
"passed","Fri Feb 14 19:15:49 GMT 2025","Fri Feb 14 19:15:49 GMT 2025","247","","Retrieve Brewery Successfully","","","","Retrieve Brewery Successfully",""
"passed","Fri Feb 14 19:15:49 GMT 2025","Fri Feb 14 19:15:49 GMT 2025","100","","Attempt to Retrieve Brewery with Invalid ID","","","","Attempt to Retrieve Brewery with Invalid ID",""
