"Status","Start Time","Stop Time","Duration in ms","Parent Suite","Suite","Sub Suite","Test Class","Test Method","Name","Description"
"passed","Thu Oct 23 19:17:49 GMT 2025","Thu Oct 23 19:17:50 GMT 2025","295","","Attempt to Retrieve Brewery with Invalid ID","","","","Attempt to Retrieve Brewery with Invalid ID",""
"passed","Thu Oct 23 19:17:50 GMT 2025","Thu Oct 23 19:17:50 GMT 2025","310","","Retrieve a Single Random Brewery","","","","Retrieve a Single Random Brewery",""
"passed","Thu Oct 23 19:17:50 GMT 2025","Thu Oct 23 19:17:50 GMT 2025","272","","Attempt to Retrieve Random Breweries with Out-of-Bounds Size","","","","Attempt to Retrieve Random Breweries with Out-of-Bounds Size",""
"passed","Thu Oct 23 19:17:50 GMT 2025","Thu Oct 23 19:17:50 GMT 2025","259","","Retrieve Multiple Random Breweries","","","","Retrieve Multiple Random Breweries",""
"passed","Thu Oct 23 19:17:49 GMT 2025","Thu Oct 23 19:17:49 GMT 2025","468","","Retrieve Brewery Successfully","","","","Retrieve Brewery Successfully",""
