"Status","Start Time","Stop Time","Duration in ms","Parent Suite","Suite","Sub Suite","Test Class","Test Method","Name","Description"
"passed","Wed Jul 30 19:20:19 GMT 2025","Wed Jul 30 19:20:20 GMT 2025","215","","Attempt to Retrieve Random Breweries with Out-of-Bounds Size","","","","Attempt to Retrieve Random Breweries with Out-of-Bounds Size",""
"passed","Wed Jul 30 19:20:18 GMT 2025","Wed Jul 30 19:20:18 GMT 2025","358","","Retrieve Brewery Successfully","","","","Retrieve Brewery Successfully",""
"passed","Wed Jul 30 19:20:18 GMT 2025","Wed Jul 30 19:20:19 GMT 2025","281","","Attempt to Retrieve Brewery with Invalid ID","","","","Attempt to Retrieve Brewery with Invalid ID",""
"passed","Wed Jul 30 19:20:19 GMT 2025","Wed Jul 30 19:20:19 GMT 2025","284","","Retrieve Multiple Random Breweries","","","","Retrieve Multiple Random Breweries",""
"passed","Wed Jul 30 19:20:19 GMT 2025","Wed Jul 30 19:20:19 GMT 2025","286","","Retrieve a Single Random Brewery","","","","Retrieve a Single Random Brewery",""
