"Status","Start Time","Stop Time","Duration in ms","Parent Suite","Suite","Sub Suite","Test Class","Test Method","Name","Description"
"passed","Tue Sep 30 19:16:45 GMT 2025","Tue Sep 30 19:16:45 GMT 2025","85","","Retrieve Multiple Random Breweries","","","","Retrieve Multiple Random Breweries",""
"passed","Tue Sep 30 19:16:45 GMT 2025","Tue Sep 30 19:16:46 GMT 2025","72","","Attempt to Retrieve Random Breweries with Out-of-Bounds Size","","","","Attempt to Retrieve Random Breweries with Out-of-Bounds Size",""
"passed","Tue Sep 30 19:16:45 GMT 2025","Tue Sep 30 19:16:45 GMT 2025","85","","Attempt to Retrieve Brewery with Invalid ID","","","","Attempt to Retrieve Brewery with Invalid ID",""
"passed","Tue Sep 30 19:16:45 GMT 2025","Tue Sep 30 19:16:45 GMT 2025","95","","Retrieve a Single Random Brewery","","","","Retrieve a Single Random Brewery",""
"passed","Tue Sep 30 19:16:45 GMT 2025","Tue Sep 30 19:16:45 GMT 2025","183","","Retrieve Brewery Successfully","","","","Retrieve Brewery Successfully",""
