"Status","Start Time","Stop Time","Duration in ms","Parent Suite","Suite","Sub Suite","Test Class","Test Method","Name","Description"
"passed","Wed Jul 02 19:18:15 GMT 2025","Wed Jul 02 19:18:16 GMT 2025","279","","Attempt to Retrieve Brewery with Invalid ID","","","","Attempt to Retrieve Brewery with Invalid ID",""
"passed","Wed Jul 02 19:18:16 GMT 2025","Wed Jul 02 19:18:16 GMT 2025","294","","Retrieve a Single Random Brewery","","","","Retrieve a Single Random Brewery",""
"passed","Wed Jul 02 19:18:16 GMT 2025","Wed Jul 02 19:18:16 GMT 2025","359","","Retrieve Multiple Random Breweries","","","","Retrieve Multiple Random Breweries",""
"passed","Wed Jul 02 19:18:16 GMT 2025","Wed Jul 02 19:18:17 GMT 2025","226","","Attempt to Retrieve Random Breweries with Out-of-Bounds Size","","","","Attempt to Retrieve Random Breweries with Out-of-Bounds Size",""
"passed","Wed Jul 02 19:18:15 GMT 2025","Wed Jul 02 19:18:15 GMT 2025","538","","Retrieve Brewery Successfully","","","","Retrieve Brewery Successfully",""
