"Status","Start Time","Stop Time","Duration in ms","Parent Suite","Suite","Sub Suite","Test Class","Test Method","Name","Description"
"passed","Sun Jan 12 19:15:25 GMT 2025","Sun Jan 12 19:15:25 GMT 2025","105","","Attempt to Retrieve Brewery with Invalid ID","","","","Attempt to Retrieve Brewery with Invalid ID",""
"passed","Sun Jan 12 19:15:25 GMT 2025","Sun Jan 12 19:15:25 GMT 2025","59","","Attempt to Retrieve Random Breweries with Out-of-Bounds Size","","","","Attempt to Retrieve Random Breweries with Out-of-Bounds Size",""
"passed","Sun Jan 12 19:15:24 GMT 2025","Sun Jan 12 19:15:25 GMT 2025","287","","Retrieve Brewery Successfully","","","","Retrieve Brewery Successfully",""
"passed","Sun Jan 12 19:15:25 GMT 2025","Sun Jan 12 19:15:25 GMT 2025","102","","Retrieve a Single Random Brewery","","","","Retrieve a Single Random Brewery",""
"passed","Sun Jan 12 19:15:25 GMT 2025","Sun Jan 12 19:15:25 GMT 2025","71","","Retrieve Multiple Random Breweries","","","","Retrieve Multiple Random Breweries",""
