"Status","Start Time","Stop Time","Duration in ms","Parent Suite","Suite","Sub Suite","Test Class","Test Method","Name","Description"
"passed","Sun Aug 24 19:16:46 GMT 2025","Sun Aug 24 19:16:47 GMT 2025","490","","Retrieve Brewery Successfully","","","","Retrieve Brewery Successfully",""
"passed","Sun Aug 24 19:16:47 GMT 2025","Sun Aug 24 19:16:48 GMT 2025","222","","Retrieve Multiple Random Breweries","","","","Retrieve Multiple Random Breweries",""
"passed","Sun Aug 24 19:16:47 GMT 2025","Sun Aug 24 19:16:47 GMT 2025","320","","Retrieve a Single Random Brewery","","","","Retrieve a Single Random Brewery",""
"passed","Sun Aug 24 19:16:47 GMT 2025","Sun Aug 24 19:16:47 GMT 2025","289","","Attempt to Retrieve Brewery with Invalid ID","","","","Attempt to Retrieve Brewery with Invalid ID",""
"passed","Sun Aug 24 19:16:48 GMT 2025","Sun Aug 24 19:16:48 GMT 2025","198","","Attempt to Retrieve Random Breweries with Out-of-Bounds Size","","","","Attempt to Retrieve Random Breweries with Out-of-Bounds Size",""
