"Status","Start Time","Stop Time","Duration in ms","Parent Suite","Suite","Sub Suite","Test Class","Test Method","Name","Description"
"passed","Wed Jun 18 19:17:57 GMT 2025","Wed Jun 18 19:17:58 GMT 2025","344","","Retrieve a Single Random Brewery","","","","Retrieve a Single Random Brewery",""
"passed","Wed Jun 18 19:17:58 GMT 2025","Wed Jun 18 19:17:58 GMT 2025","263","","Attempt to Retrieve Random Breweries with Out-of-Bounds Size","","","","Attempt to Retrieve Random Breweries with Out-of-Bounds Size",""
"passed","Wed Jun 18 19:17:57 GMT 2025","Wed Jun 18 19:17:57 GMT 2025","547","","Retrieve Brewery Successfully","","","","Retrieve Brewery Successfully",""
"passed","Wed Jun 18 19:17:58 GMT 2025","Wed Jun 18 19:17:58 GMT 2025","314","","Retrieve Multiple Random Breweries","","","","Retrieve Multiple Random Breweries",""
"passed","Wed Jun 18 19:17:57 GMT 2025","Wed Jun 18 19:17:57 GMT 2025","279","","Attempt to Retrieve Brewery with Invalid ID","","","","Attempt to Retrieve Brewery with Invalid ID",""
