"Status","Start Time","Stop Time","Duration in ms","Parent Suite","Suite","Sub Suite","Test Class","Test Method","Name","Description"
"passed","Thu Mar 06 19:15:53 GMT 2025","Thu Mar 06 19:15:53 GMT 2025","39","","Retrieve Multiple Random Breweries","","","","Retrieve Multiple Random Breweries",""
"passed","Thu Mar 06 19:15:53 GMT 2025","Thu Mar 06 19:15:53 GMT 2025","52","","Attempt to Retrieve Brewery with Invalid ID","","","","Attempt to Retrieve Brewery with Invalid ID",""
"passed","Thu Mar 06 19:15:53 GMT 2025","Thu Mar 06 19:15:53 GMT 2025","318","","Retrieve Brewery Successfully","","","","Retrieve Brewery Successfully",""
"passed","Thu Mar 06 19:15:53 GMT 2025","Thu Mar 06 19:15:53 GMT 2025","47","","Retrieve a Single Random Brewery","","","","Retrieve a Single Random Brewery",""
"passed","Thu Mar 06 19:15:53 GMT 2025","Thu Mar 06 19:15:53 GMT 2025","42","","Attempt to Retrieve Random Breweries with Out-of-Bounds Size","","","","Attempt to Retrieve Random Breweries with Out-of-Bounds Size",""
